FULL NAME,BORN,AGE,BATTING STYLE,BOWLING STYLE,PLAYING ROLE,TEAMS PLAYED,RELATIONS,IMAGE LINK
Aarya Desai,"April 03, 2003, Surat, Gujarat",20y 297d,Left hand Bat,Right arm Offbreak,Opening Batter,"Gujarat, Kolkata Knight Riders",,https://wassets.hscicdn.com/static/images/player-jersey.svg
Pappanayil Abdul Basith,"October 09, 1998, Ernakulam, Kerala",25y 108d,Right hand Bat,Right arm Offbreak,Allrounder,"Kerala, Rajasthan Royals",,https://wassets.hscicdn.com/static/images/player-jersey.svg
Abdul Samad Farooq,"October 28, 2001, Kala Kot, Jammu & Kashmir",22y 89d,Right hand Bat,Legbreak,Batter,"Jammu & Kashmir, Sunrisers Hyderabad",,"https://img1.hscicdn.com/image/upload/f_auto,t_ds_square_w_640,q_50/lsci/db/PICTURES/CMS/339100/339145.png"
Abhijeet Saket,"August 03, 1995, Patna, Bihar",28y 175d,Right hand Bat,Right arm Medium,,Bihar,,https://wassets.hscicdn.com/static/images/player-jersey.svg
Kanwar Abhinay Singh,"June 16, 1991, Hamirpur, Himachal Pradesh",32y 223d,Right hand Bat,Right arm Fast medium,Bowler,Himachal Pradesh,,https://wassets.hscicdn.com/static/images/player-jersey.svg
Abhishek Goswami,"November 06, 1997, Delhi",26y 80d,Right hand Bat,Right arm Offbreak,Opening Batter,"India Under-19s, Uttar Pradesh, Uttar Pradesh Under-19s",,https://wassets.hscicdn.com/static/images/player-jersey.svg
Abhishek Sharma,"September 04, 2000, Amritsar, Punjab",23y 143d,Left hand Bat,Slow Left arm Orthodox,Allrounder,"Delhi Daredevils, India Under-19s, Punjab, Punjab Under-16s, Punjab Under-19s, Sunrisers Hyderabad",,"https://img1.hscicdn.com/image/upload/f_auto,t_ds_square_w_640,q_50/lsci/db/PICTURES/CMS/358000/358037.png"
Abhishek Singh,"March 06, 2003",20y 325d,Right hand Bat,Right arm Offbreak,,Chandigarh,,https://wassets.hscicdn.com/static/images/player-jersey.svg
Abhishek Yadav,"June 08, 1995, Gorakhpur, Uttar Pradesh",28y 231d,Left hand Bat,,,"Odisha, Railways",,https://wassets.hscicdn.com/static/images/player-jersey.svg
Abid Mushtaq Mangnoo,"January 17, 1997, Doda, Jammu & Kashmir",27y 8d,Left hand Bat,Slow Left arm Orthodox,,Jammu & Kashmir,,https://wassets.hscicdn.com/static/images/player-jersey.svg
Abishek Porel,"October 17, 2002",21y 100d,Left hand Bat,,Wicketkeeper Batter,"Bengal, Delhi Capitals, Durgapur Dazzlers",,https://wassets.hscicdn.com/static/images/player-jersey.svg
Aditya Jadeja,"March 18, 2002",21y 313d,Left hand Bat,Left arm Medium,,Kathiawar,,https://wassets.hscicdn.com/static/images/player-jersey.svg
Mayank Anurag Agarwal,"February 16, 1991, Bangalore, Karnataka",32y 343d,Right hand Bat,Right arm Offbreak,Batter,"India, Belagavi Panthers, Bellary Tuskers, Bengaluru Blasters, Chemplast, Delhi Daredevils, India A, India B, India Blue, India C, India Red, India Under-19s, Indian Board President's XI, Karnataka, Karnataka State Cricket Association Colts XI, Karnataka Under-19s, Kings XI Punjab, Madras Cricket Club, Rest of India, Rising Pune Supergiant, Royal Challengers Bangalore, Shamanoor Davangere Diamonds, South Zone, Sunrisers Hyderabad",,"https://img1.hscicdn.com/image/upload/f_auto,t_ds_square_w_640,q_50/lsci/db/PICTURES/CMS/322600/322626.png"
Shubham Sanjay Agarwal,"November 21, 1993, Raigadh, Gujarat",30y 65d,Right hand Bat,Legbreak Googly,,"Chhattisgarh, Gujarat Lions",,https://wassets.hscicdn.com/static/images/player-jersey.svg
Tanmay Dharamchand Agarwal,"May 03, 1995, Hyderabad, Andhra Pradesh",28y 267d,Left hand Bat,Legbreak Googly,Opening Batter,"Hyderabad (India), Hyderabad Under-14s, Hyderabad Under-16s, Hyderabad Under-19s, Hyderabad Under-22s, Hyderabad Under-25s, Sunrisers Hyderabad",,https://wassets.hscicdn.com/static/images/player-jersey.svg
Khaleel Khursheed Ahmed,"December 05, 1997, Tonk, Rajasthan",26y 51d,Right hand Bat,Left arm Medium,Bowler,"India, Delhi Capitals, India A, India B, India Under-19s, Rajasthan, Rajasthan Under-16s, Rajasthan Under-19s, Sunrisers Hyderabad",,"https://img1.hscicdn.com/image/upload/f_auto,t_ds_square_w_640,q_50/lsci/db/PICTURES/CMS/322200/322268.png"
Maruthungal Rasheed Ajinas,"May 08, 1997, Wayanad, Kerala",26y 262d,Right hand Bat,,,Kerala,,https://wassets.hscicdn.com/static/images/player-jersey.svg
Guruswamy Ajitesh,"September 26, 2002",21y 121d,Right hand Bat,,Batter,"Nellai Royal Kings, Tamil Nadu",,https://wassets.hscicdn.com/static/images/player-jersey.svg
Akash Deep,"December 15, 1996, Dehri, (Rotas), Bihar",27y 41d,Right hand Bat,Right arm Fast medium,Bowling Allrounder,"Bengal, Rest of India, Royal Challengers Bangalore",,"https://img1.hscicdn.com/image/upload/f_auto,t_ds_square_w_640,q_50/lsci/db/PICTURES/CMS/340300/340311.png"
Akash Maharaj Singh,"April 26, 2002, Bharatpur, Rajasthan",21y 274d,Right hand Bat,Left arm Medium fast,Bowler,"Chennai Super Kings, India A Under-19s, India Under-19s, Nagaland, Rajasthan, Rajasthan Royals",,https://wassets.hscicdn.com/static/images/player-jersey.svg
Akash Sudan,"May 07, 1993",30y 263d,Left hand Bat,Right arm Medium,,"Chandigarh, Delhi",,https://wassets.hscicdn.com/static/images/player-jersey.svg
Shambu Akhil,"October 22, 1998",25y 95d,Right hand Bat,Right arm Medium fast,,Bezawada Tigers,,https://wassets.hscicdn.com/static/images/player-jersey.svg
Akshit Rana,"February 08, 2002, Barwala, Panchkula",21y 351d,Right hand Bat,,,Chandigarh,,https://wassets.hscicdn.com/static/images/player-jersey.svg
Al Bashid Muhammed,"April 27, 1998, Thoubal, Manipur",25y 273d,Right hand Bat,,,Manipur,,https://wassets.hscicdn.com/static/images/player-jersey.svg
Felix Bernado Alemao,"July 20, 1995, Margao, Goa",28y 189d,Right hand Bat,Right arm Medium,Bowler,"Goa, Goa Under-19s, Goa Under-22s",,https://wassets.hscicdn.com/static/images/player-jersey.svg
Aman Hakim Khan,"November 23, 1996",27y 63d,Right hand Bat,Right arm Medium,Allrounder,"Delhi Capitals, Kolkata Knight Riders, Mumbai",,"https://img1.hscicdn.com/image/upload/f_auto,t_ds_square_w_640,q_50/lsci/db/PICTURES/CMS/341000/341035.png"
Amit Muslem Ali,"October 26, 2002, Bishalgarh, Tripura",21y 91d,Right hand Bat,Legbreak,Bowling Allrounder,Tripura,,https://wassets.hscicdn.com/static/images/player-jersey.svg
Jehu Anderson,"November 12, 1999, Aizawl",24y 74d,Right hand Bat,,,Mizoram,,https://wassets.hscicdn.com/static/images/player-jersey.svg
Gangam Anikethreddy,"October 28, 2000, Nizamabad, Andhra Pradesh",23y 89d,Right hand Bat,Slow Left arm Orthodox,,Hyderabad (India),,https://wassets.hscicdn.com/static/images/player-jersey.svg
Ankit Kumar,"November 01, 1997, Shahabad, Kurukshetra",26y 85d,Right hand Bat,Right arm Offbreak,Top order Batter,Haryana,,https://wassets.hscicdn.com/static/images/player-jersey.svg
Atharva Vinod Ankolekar,"September 26, 2000",23y 121d,Left hand Bat,Slow Left arm Orthodox,,"India B Under-19s, Mumbai",,https://wassets.hscicdn.com/static/images/player-jersey.svg
Ankur Malik,"November 05, 2003, Meerutm Uttar Pradesh",20y 81d,Right hand Bat,Legbreak,Allrounder,Sikkim,,https://wassets.hscicdn.com/static/images/player-jersey.svg
Anmolpreet Singh,"March 28, 1998, Patiala, Punjab",25y 303d,Right hand Bat,Right arm Offbreak,Batter,"India A, India Blue, India C, India Under-19s, Indian Board President's XI, Mumbai Indians, Punjab, Punjab Under-16s, Punjab Under-19s, Rest of India, Sunrisers Hyderabad",,"https://img1.hscicdn.com/image/upload/f_auto,t_ds_square_w_640,q_50/lsci/db/PICTURES/CMS/358000/358038.png"
Anuj Rawat,"October 17, 1999, Ram Nagar, Uttarakhand",24y 100d,Left hand Bat,,Wicketkeeper Batter,"Delhi, Delhi Under-19s, India Under-19s, Rajasthan Royals, Royal Challengers Bangalore",,"https://img1.hscicdn.com/image/upload/f_auto,t_ds_square_w_640,q_50/lsci/db/PICTURES/CMS/359700/359757.png"
Anujit Parmar,"November 26, 1995, Patna",28y 60d,Right hand Bat,,,Bihar,,https://wassets.hscicdn.com/static/images/player-jersey.svg
Baba Aparajith,"July 08, 1994, Chennai",29y 201d,Right hand Bat,Right arm Offbreak,Batting Allrounder,"Chennai Super Kings, Chepauk Super Gillies, India A, India B, India Blue, India Emerging Players, India Red, India Under-19s, India Under-23s, Nellai Royal Kings, Rest of India, Rising Pune Supergiants, South Zone, Tamil Nadu, Tamil Nadu Districts XI",,https://wassets.hscicdn.com/static/images/player-jersey.svg
Mohdajaz Arafat Khan,"December 27, 1996, Jhalawar, Rajasthan",27y 29d,Right hand Bat,Right arm Medium,Bowler,"Jaipur Pink City Royals, Rajasthan",,https://wassets.hscicdn.com/static/images/player-jersey.svg
A Aravinddaraj,"June 09, 1996",27y 230d,Right hand Bat,Right arm Medium,,Puducherry,,https://wassets.hscicdn.com/static/images/player-jersey.svg
Arjit Pannu,"April 24, 1996, Chandigarh, Punjab",27y 276d,Right hand Bat,Legbreak,,Chandigarh,,https://wassets.hscicdn.com/static/images/player-jersey.svg
Arjun Azad,"August 08, 2001, Chandigarh",22y 170d,Right hand Bat,Legbreak,,"Chandigarh, India A Under-19s",,https://wassets.hscicdn.com/static/images/player-jersey.svg
Vaibhav Gopal Arora,"December 14, 1997",26y 42d,Right hand Bat,Right arm Fast medium,Bowler,"Himachal Pradesh, Kolkata Knight Riders, Punjab Kings",,https://wassets.hscicdn.com/static/images/player-jersey.svg
Mohd Arshad Khan,"December 20, 1997, Gopalganj (Seoni)",26y 36d,Left hand Bat,Left arm Medium,Bowler,"Madhya Pradesh, Mumbai Indians",,https://wassets.hscicdn.com/static/images/player-jersey.svg
Arshdeep Singh,"February 05, 1999, Guna, Madhya Pradesh",24y 354d,Left hand Bat,Left arm Medium fast,Bowler,"India, India Under-19s, India Under-23s, Kent, Kings XI Punjab, Punjab",,"https://img1.hscicdn.com/image/upload/f_auto,t_ds_square_w_640,q_50/lsci/db/PICTURES/CMS/322100/322178.png"
Konda Bhaskir Arun Karthik,"February 15, 1986, Walajapet, Tamil Nadu",37y 344d,Right hand Bat,Legbreak Googly,Wicketkeeper Batter,"Badureliya Sports Club, Chennai Super Kings, Nellai Royal Kings, Puducherry, Royal Challengers Bangalore, Siechem Madurai Panthers, Tamil Nadu",,https://wassets.hscicdn.com/static/images/player-jersey.svg
Priyansh Arya,"January 18, 2001",23y 7d,Left hand Bat,Right arm Offbreak,,"Delhi, India A Under-19s",,https://wassets.hscicdn.com/static/images/player-jersey.svg
Aryan Sahani,"June 21, 2007",16y 218d,Right hand Bat,Right arm Medium fast,,Arunachal Pradesh,,https://wassets.hscicdn.com/static/images/player-jersey.svg
Kattingeri Ashwin Hebbar,"November 15, 1995, Nellore, Andhra Pradesh",28y 71d,Right hand Bat,Right arm Slow medium,Opening Batter,"Andhra, Delhi Capitals",,https://wassets.hscicdn.com/static/images/player-jersey.svg
Murugan Ashwin,"September 08, 1990, Chennai, Tamil Nadu",33y 139d,Right hand Bat,Legbreak Googly,Bowler,"Chandigarh, Chepauk Super Gillies, Delhi Daredevils, Dindigul Dragons, India Red, Kings XI Punjab, Mumbai Indians, Rajasthan Royals, Rising Pune Supergiants, Royal Challengers Bangalore, Salem Spartans, Siechem Madurai Panthers, Tamil Nadu, TNCA President's XI",,https://wassets.hscicdn.com/static/images/player-jersey.svg
Ravichandran Ashwin,"September 17, 1986, Madras (now Chennai), Tamil Nadu",37y 130d,Right hand Bat,Right arm Offbreak,Bowling Allrounder,"India, Chennai Super Kings, Delhi Capitals, Dindigul Dragons, India A, India Blue, India Cements, India Emerging Players, India Green, India Red, Indian Board President's XI, Kings XI Punjab, Nottinghamshire, Rajasthan Royals, Rest of India, Rising Pune Supergiants, South Zone, Tamil Nadu, Tamil Nadu Cricket Association XI, Worcestershire",,"https://img1.hscicdn.com/image/upload/f_auto,t_ds_square_w_640,q_50/lsci/db/PICTURES/CMS/316500/316521.png"
KM Asif,"July 24, 1993, Edavanna,Malappuram",30y 185d,Right hand Bat,Right arm Medium,Bowler,"Chennai Super Kings, Kerala, Kerala Under-22s, Kerala Under-25s, Rajasthan Royals",,"https://img1.hscicdn.com/image/upload/f_auto,t_ds_square_w_640,q_50/lsci/db/PICTURES/CMS/339100/339151.png"
